{
  "$schema": "https://json-schema.org/draft/2020-12/schema",
  "$id": "https://kratos.dev/schemas/state/event/v1.3",
  "title": "Kratos append-only event v1.3",
  "type": "object",
  "additionalProperties": false,
  "required": [
    "contractVersion",
    "stateContract",
    "eventId",
    "eventType",
    "occurredAt",
    "operation",
    "policyVersion",
    "priorRevision",
    "resultingRevision",
    "reasonCode",
    "effect",
    "artifactRefs",
    "evidenceRefs",
    "observedIdentity",
    "previousHash",
    "eventHash"
  ],
  "properties": {
    "contractVersion": { "const": "1.3.0" },
    "stateContract": { "const": "1.3.0" },
    "eventId": { "$ref": "#/$defs/id" },
    "eventType": {
      "enum": ["operation", "decision", "transition", "recovery"]
    },
    "occurredAt": { "$ref": "#/$defs/timestamp" },
    "operation": { "$ref": "#/$defs/id" },
    "policyVersion": { "$ref": "#/$defs/id" },
    "priorRevision": { "$ref": "#/$defs/nonNegativeInteger" },
    "resultingRevision": { "$ref": "#/$defs/positiveInteger" },
    "reasonCode": {
      "type": "string",
      "pattern": "^[a-z][a-z0-9_]*(?:\\.[a-z0-9_]+)*$"
    },
    "effect": { "enum": ["none", "state", "artifact", "state-and-artifact"] },
    "artifactRefs": { "$ref": "#/$defs/references" },
    "evidenceRefs": { "$ref": "#/$defs/references" },
    "observedIdentity": { "$ref": "#/$defs/observedIdentity" },
    "resolvedAssignment": { "$ref": "#/$defs/resolvedAssignment" },
    "runLimits": { "$ref": "#/$defs/runLimits" },
    "acceptanceDecision": { "$ref": "#/$defs/acceptanceDecision" },
    "repairResolution": { "$ref": "#/$defs/repairResolution" },
    "startedFromSpec": { "$ref": "#/$defs/startedFromSpec" },
    "previousHash": {
      "oneOf": [{ "$ref": "#/$defs/sha256" }, { "type": "null" }]
    },
    "eventHash": { "$ref": "#/$defs/sha256" }
  },
  "$defs": {
    "id": {
      "type": "string",
      "pattern": "^[a-zA-Z0-9][a-zA-Z0-9._:-]{0,127}$"
    },
    "sha256": { "type": "string", "pattern": "^[a-f0-9]{64}$" },
    "timestamp": {
      "type": "string",
      "pattern": "^\\d{4}-(?:0[1-9]|1[0-2])-(?:0[1-9]|[12]\\d|3[01])T(?:[01]\\d|2[0-3]):[0-5]\\d:[0-5]\\d(?:\\.\\d{1,9})?Z$"
    },
    "reference": {
      "type": "string",
      "minLength": 1,
      "maxLength": 1024,
      "pattern": "^(?!/)(?![A-Za-z]:[\\\\/])(?!.*\\\\)(?!.*(?:^|/)\\.\\.(?:/|$))(?![a-z][a-z0-9+.-]*://)[^\\u0000-\\u001f\\u007f]+$"
    },
    "references": {
      "type": "array",
      "maxItems": 256,
      "items": { "$ref": "#/$defs/reference" },
      "uniqueItems": true
    },
    "nonNegativeInteger": {
      "type": "integer",
      "minimum": 0,
      "maximum": 9007199254740991
    },
    "positiveInteger": {
      "type": "integer",
      "minimum": 1,
      "maximum": 9007199254740991
    },
    "observedIdentity": {
      "type": "object",
      "additionalProperties": false,
      "required": ["host", "model", "effort"],
      "properties": {
        "host": { "$ref": "#/$defs/id" },
        "model": { "oneOf": [{ "$ref": "#/$defs/id" }, { "type": "null" }] },
        "effort": { "oneOf": [{ "$ref": "#/$defs/id" }, { "type": "null" }] }
      }
    },
    "resolvedAssignment": {
      "type": "object",
      "additionalProperties": false,
      "required": ["phase", "role", "model", "effort"],
      "properties": {
        "phase": {
          "enum": ["prd", "spec", "plan", "code", "review", "acceptance"]
        },
        "role": { "enum": ["planner", "implementer", "judge"] },
        "model": { "$ref": "#/$defs/id" },
        "effort": { "$ref": "#/$defs/id" }
      }
    },
    "runLimits": {
      "type": "object",
      "additionalProperties": false,
      "required": ["acceptanceAttemptCeiling", "tokenCeiling"],
      "properties": {
        "acceptanceAttemptCeiling": { "$ref": "#/$defs/positiveInteger" },
        "tokenCeiling": {
          "oneOf": [{ "$ref": "#/$defs/positiveInteger" }, { "type": "null" }]
        }
      }
    },
    "attempt": {
      "type": "object",
      "additionalProperties": false,
      "required": ["criterionId", "attempt"],
      "properties": {
        "criterionId": {
          "$ref": "https://kratos.dev/schemas/contracts/acceptance-criterion-id/v1"
        },
        "attempt": { "$ref": "#/$defs/positiveInteger" }
      }
    },
    "repairStop": {
      "type": "object",
      "additionalProperties": false,
      "required": [
        "criterionId",
        "attempt",
        "classification",
        "artifactRef",
        "artifactDigest"
      ],
      "properties": {
        "criterionId": {
          "$ref": "https://kratos.dev/schemas/contracts/acceptance-criterion-id/v1"
        },
        "attempt": { "$ref": "#/$defs/positiveInteger" },
        "classification": { "enum": ["code", "specification"] },
        "artifactRef": { "$ref": "#/$defs/reference" },
        "artifactDigest": { "$ref": "#/$defs/sha256" }
      }
    },
    "acceptanceDecision": {
      "type": "object",
      "additionalProperties": false,
      "required": ["outcome", "attempts", "repairStops"],
      "properties": {
        "outcome": { "enum": ["passed", "repair", "stopped"] },
        "attempts": {
          "type": "array",
          "maxItems": 256,
          "items": { "$ref": "#/$defs/attempt" },
          "uniqueItems": true
        },
        "repairStops": {
          "type": "array",
          "maxItems": 256,
          "items": { "$ref": "#/$defs/repairStop" },
          "uniqueItems": true
        }
      },
      "allOf": [
        {
          "if": {
            "properties": { "outcome": { "const": "stopped" } },
            "required": ["outcome"]
          },
          "then": {
            "properties": { "repairStops": { "type": "array", "minItems": 1 } }
          },
          "else": {
            "properties": { "repairStops": { "type": "array", "maxItems": 0 } }
          }
        }
      ]
    },
    "repairResolution": {
      "type": "object",
      "additionalProperties": false,
      "required": [
        "criterionId",
        "classification",
        "resolutionRef",
        "resolutionDigest",
        "nextRunId",
        "restartTicketRef",
        "restartTicketDigest"
      ],
      "properties": {
        "criterionId": {
          "$ref": "https://kratos.dev/schemas/contracts/acceptance-criterion-id/v1"
        },
        "classification": { "enum": ["code", "specification"] },
        "resolutionRef": { "$ref": "#/$defs/reference" },
        "resolutionDigest": { "$ref": "#/$defs/sha256" },
        "nextRunId": {
          "oneOf": [{ "$ref": "#/$defs/id" }, { "type": "null" }]
        },
        "restartTicketRef": {
          "oneOf": [{ "$ref": "#/$defs/reference" }, { "type": "null" }]
        },
        "restartTicketDigest": {
          "oneOf": [{ "$ref": "#/$defs/sha256" }, { "type": "null" }]
        }
      }
    },
    "startedFromSpec": {
      "type": "object",
      "additionalProperties": false,
      "required": [
        "sourceRunId",
        "restartTicketRef",
        "restartTicketDigest",
        "retiredCriterionIds"
      ],
      "properties": {
        "sourceRunId": { "$ref": "#/$defs/id" },
        "restartTicketRef": { "$ref": "#/$defs/reference" },
        "restartTicketDigest": { "$ref": "#/$defs/sha256" },
        "retiredCriterionIds": {
          "type": "array",
          "minItems": 1,
          "maxItems": 256,
          "uniqueItems": true,
          "items": {
            "$ref": "https://kratos.dev/schemas/contracts/acceptance-criterion-id/v1"
          }
        }
      }
    }
  }
}
