{
  "contractVersion": "1.3.0",
  "stateContract": "1.3.0",
  "eventId": "event-resolution-01",
  "eventType": "recovery",
  "occurredAt": "2026-08-30T00:04:00Z",
  "operation": "sdd.repair.resolve:resolution-01",
  "policyVersion": "workflow-v2",
  "priorRevision": 7,
  "resultingRevision": 8,
  "reasonCode": "run.repair_stop.resolved",
  "effect": "state-and-artifact",
  "artifactRefs": [".brain/runs/run-01/resolutions/resolution-01.json"],
  "evidenceRefs": [],
  "observedIdentity": {
    "host": "codex",
    "model": "gpt-5.6-terra",
    "effort": "medium"
  },
  "repairResolution": {
    "criterionId": "AC-1.1.1",
    "classification": "code",
    "resolutionRef": ".brain/runs/run-01/resolutions/resolution-01.json",
    "resolutionDigest": "bbbbbbbbbbbbbbbbbbbbbbbbbbbbbbbbbbbbbbbbbbbbbbbbbbbbbbbbbbbbbbbb",
    "nextRunId": null,
    "restartTicketRef": null,
    "restartTicketDigest": null
  },
  "previousHash": "aaaaaaaaaaaaaaaaaaaaaaaaaaaaaaaaaaaaaaaaaaaaaaaaaaaaaaaaaaaaaaaa",
  "eventHash": "cccccccccccccccccccccccccccccccccccccccccccccccccccccccccccccccc"
}
